{
  "schema": "DOWNSTREAM-ORDER-READER-01-MANIFEST-v1",
  "mode": "PROSPECTIVE_UNSEALED_NO_SEEDS",
  "accepted_parent": "75e405627e0b48428a5c71f31b8a2025726b763c",
  "execution_authorized": false,
  "human_review": {
    "status": "PENDING",
    "reviewer": null,
    "date": null
  },
  "namespace_audit": {
    "status": "NOT_PERFORMED",
    "evidence": null
  },
  "statistical_unit": "original source world",
  "branches_and_arms_increase_n": false,
  "fixed_maximum_source_worlds": 48,
  "minimum_complete_worlds": 18,
  "adaptive_extension_after_outcomes": false,
  "equivalence_margin": null,
  "design": {
    "histories": ["H_L_EARLY", "H_L_LATE", "H_H_EARLY", "H_H_LATE"],
    "source_lam_minus": {"zero": 0.0, "intact": 0.15},
    "ramp_arms": {"minus": -1, "sham": 0, "plus": 1},
    "settle_steps": 40,
    "source_expression_steps": 1,
    "response_steps": 1,
    "ramp_epsilon_c": 0.01,
    "core_radius": 10,
    "response_lam_minus": 0.15,
    "up_ref_zero": true
  },
  "world_slots": [
    {"world_id": "W001", "seed": "<SEED_001>"},
    {"world_id": "W002", "seed": "<SEED_002>"},
    {"world_id": "W003", "seed": "<SEED_003>"},
    {"world_id": "W004", "seed": "<SEED_004>"},
    {"world_id": "W005", "seed": "<SEED_005>"},
    {"world_id": "W006", "seed": "<SEED_006>"},
    {"world_id": "W007", "seed": "<SEED_007>"},
    {"world_id": "W008", "seed": "<SEED_008>"},
    {"world_id": "W009", "seed": "<SEED_009>"},
    {"world_id": "W010", "seed": "<SEED_010>"},
    {"world_id": "W011", "seed": "<SEED_011>"},
    {"world_id": "W012", "seed": "<SEED_012>"},
    {"world_id": "W013", "seed": "<SEED_013>"},
    {"world_id": "W014", "seed": "<SEED_014>"},
    {"world_id": "W015", "seed": "<SEED_015>"},
    {"world_id": "W016", "seed": "<SEED_016>"},
    {"world_id": "W017", "seed": "<SEED_017>"},
    {"world_id": "W018", "seed": "<SEED_018>"},
    {"world_id": "W019", "seed": "<SEED_019>"},
    {"world_id": "W020", "seed": "<SEED_020>"},
    {"world_id": "W021", "seed": "<SEED_021>"},
    {"world_id": "W022", "seed": "<SEED_022>"},
    {"world_id": "W023", "seed": "<SEED_023>"},
    {"world_id": "W024", "seed": "<SEED_024>"},
    {"world_id": "W025", "seed": "<SEED_025>"},
    {"world_id": "W026", "seed": "<SEED_026>"},
    {"world_id": "W027", "seed": "<SEED_027>"},
    {"world_id": "W028", "seed": "<SEED_028>"},
    {"world_id": "W029", "seed": "<SEED_029>"},
    {"world_id": "W030", "seed": "<SEED_030>"},
    {"world_id": "W031", "seed": "<SEED_031>"},
    {"world_id": "W032", "seed": "<SEED_032>"},
    {"world_id": "W033", "seed": "<SEED_033>"},
    {"world_id": "W034", "seed": "<SEED_034>"},
    {"world_id": "W035", "seed": "<SEED_035>"},
    {"world_id": "W036", "seed": "<SEED_036>"},
    {"world_id": "W037", "seed": "<SEED_037>"},
    {"world_id": "W038", "seed": "<SEED_038>"},
    {"world_id": "W039", "seed": "<SEED_039>"},
    {"world_id": "W040", "seed": "<SEED_040>"},
    {"world_id": "W041", "seed": "<SEED_041>"},
    {"world_id": "W042", "seed": "<SEED_042>"},
    {"world_id": "W043", "seed": "<SEED_043>"},
    {"world_id": "W044", "seed": "<SEED_044>"},
    {"world_id": "W045", "seed": "<SEED_045>"},
    {"world_id": "W046", "seed": "<SEED_046>"},
    {"world_id": "W047", "seed": "<SEED_047>"},
    {"world_id": "W048", "seed": "<SEED_048>"}
  ]
}
